{
  "$id": "https://quantum-l9.dev/schemas/risk-record.schema.json",
  "$schema": "https://json-schema.org/draft/2020-12/schema",
  "additionalProperties": false,
  "properties": {
    "category": {
      "title": "Category",
      "type": "string"
    },
    "description": {
      "title": "Description",
      "type": "string"
    },
    "evidence_refs": {
      "default": [],
      "items": {
        "type": "string"
      },
      "title": "Evidence Refs",
      "type": "array"
    },
    "remediation": {
      "anyOf": [
        {
          "type": "string"
        },
        {
          "type": "null"
        }
      ],
      "default": null,
      "title": "Remediation"
    },
    "risk_id": {
      "title": "Risk Id",
      "type": "string"
    },
    "rule_id": {
      "title": "Rule Id",
      "type": "string"
    },
    "rule_version": {
      "title": "Rule Version",
      "type": "string"
    },
    "severity": {
      "enum": [
        "low",
        "medium",
        "high",
        "critical"
      ],
      "title": "Severity",
      "type": "string"
    },
    "status": {
      "default": "open",
      "enum": [
        "open",
        "accepted",
        "mitigated",
        "resolved"
      ],
      "title": "Status",
      "type": "string"
    },
    "subject_id": {
      "title": "Subject Id",
      "type": "string"
    }
  },
  "required": [
    "risk_id",
    "subject_id",
    "severity",
    "category",
    "description",
    "rule_id",
    "rule_version"
  ],
  "title": "RiskRecord",
  "type": "object"
}
