[{"category":"unresolved_dependency","description":"Dependency 'httpx' does not resolve to an input repository.","evidence_refs":["evidence:08ca8f0cd96a01443445b6387276901fbaf327dffc2300a6db16a341bf1959ef","evidence:2b5e0a5f4722f1f0912ed76f4154d926770011124bcbddbc892f04c67c9d4b15","evidence:557d52b82c0b9cf39a92ad68dc6f894ce490cfced8974cea75adcd3eea642d8e","evidence:77ea38aad92ee15e35e79e63a72d6bf1578f61a214f76d96efe25ccbcbd4412c","evidence:9745cf9f5aa2a55d0d0ec956f595a9102051224f6da654c5e756128b06ba6c50","evidence:ad85781ad2fab7fd28d63dd6e14ddbc6fa1d3b54ce1978223c93bc704ae485e5","evidence:d2338cd112c2b2367b1e129321fa71b7ea910795b0328749b40ebc0e454cd0e6"],"remediation":"Provide the missing Repository Model Packet or mark the dependency external.","risk_id":"risk:2a3a5963710e863ac306b0ff7e81232c0bb1798d30eee921812b02ca97b82c1b","rule_id":"unresolved-dependency","rule_version":"1.0.0","severity":"medium","status":"open","subject_id":"repo:l9-gate-sdk"},{"category":"unresolved_dependency","description":"Dependency 'uvicorn' does not resolve to an input repository.","evidence_refs":["evidence:053ade54eab180cfb6442885f9b719e70855791f3ca2005aaf8172f26077af5a","evidence:69a738878ad517887bb645a85d8020726f36ac3d8c9b988befd492ab82c9f402","evidence:8f4331cf9239c6121cb63ea3568998cdf31f0cf1cc1beef54201ac03d6ebd525","evidence:944d594375fc539e595d57462092de4c3af2837ec28ab2be4712373efd08be46","evidence:c87556ab9f0ac784f89a55b400f8a6c61be905b44e23f5d40e47aaa6c4a376a5","evidence:d538fed45f2e9814b7540a1928f642f4a07c1f6babca0d515e02a58b027be91a"],"remediation":"Provide the missing Repository Model Packet or mark the dependency external.","risk_id":"risk:68330d32dc9854df113b359ce3843be0fac30053301e4fadc991580c8a303afc","rule_id":"unresolved-dependency","rule_version":"1.0.0","severity":"medium","status":"open","subject_id":"repo:l9-mcp-server"},{"category":"governance_gap","description":"No governance artifact is declared or observed.","evidence_refs":["evidence:053ade54eab180cfb6442885f9b719e70855791f3ca2005aaf8172f26077af5a","evidence:69a738878ad517887bb645a85d8020726f36ac3d8c9b988befd492ab82c9f402","evidence:8f4331cf9239c6121cb63ea3568998cdf31f0cf1cc1beef54201ac03d6ebd525","evidence:944d594375fc539e595d57462092de4c3af2837ec28ab2be4712373efd08be46","evidence:c87556ab9f0ac784f89a55b400f8a6c61be905b44e23f5d40e47aaa6c4a376a5","evidence:d538fed45f2e9814b7540a1928f642f4a07c1f6babca0d515e02a58b027be91a"],"risk_id":"risk:bcd2b9133f951f2fa09aa5886737197c2fe5ce7c5e61ce9ac3dc5f9a187151bb","rule_id":"missing-governance","rule_version":"1.0.0","severity":"medium","status":"open","subject_id":"repo:l9-mcp-server"},{"category":"unresolved_dependency","description":"Dependency 'fastapi' does not resolve to an input repository.","evidence_refs":["evidence:053ade54eab180cfb6442885f9b719e70855791f3ca2005aaf8172f26077af5a","evidence:69a738878ad517887bb645a85d8020726f36ac3d8c9b988befd492ab82c9f402","evidence:8f4331cf9239c6121cb63ea3568998cdf31f0cf1cc1beef54201ac03d6ebd525","evidence:944d594375fc539e595d57462092de4c3af2837ec28ab2be4712373efd08be46","evidence:c87556ab9f0ac784f89a55b400f8a6c61be905b44e23f5d40e47aaa6c4a376a5","evidence:d538fed45f2e9814b7540a1928f642f4a07c1f6babca0d515e02a58b027be91a"],"remediation":"Provide the missing Repository Model Packet or mark the dependency external.","risk_id":"risk:ede422b199201f4971d348fa32157d2c05c66c81ed2db9f89ebe43541db0fa0d","rule_id":"unresolved-dependency","rule_version":"1.0.0","severity":"medium","status":"open","subject_id":"repo:l9-mcp-server"},{"category":"unresolved_dependency","description":"Dependency 'pydantic' does not resolve to an input repository.","evidence_refs":["evidence:08ca8f0cd96a01443445b6387276901fbaf327dffc2300a6db16a341bf1959ef","evidence:2b5e0a5f4722f1f0912ed76f4154d926770011124bcbddbc892f04c67c9d4b15","evidence:557d52b82c0b9cf39a92ad68dc6f894ce490cfced8974cea75adcd3eea642d8e","evidence:77ea38aad92ee15e35e79e63a72d6bf1578f61a214f76d96efe25ccbcbd4412c","evidence:9745cf9f5aa2a55d0d0ec956f595a9102051224f6da654c5e756128b06ba6c50","evidence:ad85781ad2fab7fd28d63dd6e14ddbc6fa1d3b54ce1978223c93bc704ae485e5","evidence:d2338cd112c2b2367b1e129321fa71b7ea910795b0328749b40ebc0e454cd0e6"],"remediation":"Provide the missing Repository Model Packet or mark the dependency external.","risk_id":"risk:f73b65ac971987011045cdd125a5106469ac7b6bc84467c56c10b804ad20084e","rule_id":"unresolved-dependency","rule_version":"1.0.0","severity":"medium","status":"open","subject_id":"repo:l9-gate-sdk"},{"category":"adr_gap","description":"No architecture decision record is declared or observed.","evidence_refs":["evidence:053ade54eab180cfb6442885f9b719e70855791f3ca2005aaf8172f26077af5a","evidence:69a738878ad517887bb645a85d8020726f36ac3d8c9b988befd492ab82c9f402","evidence:8f4331cf9239c6121cb63ea3568998cdf31f0cf1cc1beef54201ac03d6ebd525","evidence:944d594375fc539e595d57462092de4c3af2837ec28ab2be4712373efd08be46","evidence:c87556ab9f0ac784f89a55b400f8a6c61be905b44e23f5d40e47aaa6c4a376a5","evidence:d538fed45f2e9814b7540a1928f642f4a07c1f6babca0d515e02a58b027be91a"],"risk_id":"risk:fadbcfa6af80f7e7dacfd6a3a20b32808cb8982d02490a68200f4641fcfd4580","rule_id":"missing-adr","rule_version":"1.0.0","severity":"low","status":"open","subject_id":"repo:l9-mcp-server"},{"category":"ownership_gap","description":"No repository owner is declared or observed.","evidence_refs":["evidence:053ade54eab180cfb6442885f9b719e70855791f3ca2005aaf8172f26077af5a","evidence:69a738878ad517887bb645a85d8020726f36ac3d8c9b988befd492ab82c9f402","evidence:8f4331cf9239c6121cb63ea3568998cdf31f0cf1cc1beef54201ac03d6ebd525","evidence:944d594375fc539e595d57462092de4c3af2837ec28ab2be4712373efd08be46","evidence:c87556ab9f0ac784f89a55b400f8a6c61be905b44e23f5d40e47aaa6c4a376a5","evidence:d538fed45f2e9814b7540a1928f642f4a07c1f6babca0d515e02a58b027be91a"],"risk_id":"risk:fd133098951f662ee19e90cda85ee88802c343e7a99b0f0e98721b484aed9818","rule_id":"missing-owner","rule_version":"1.0.0","severity":"medium","status":"open","subject_id":"repo:l9-mcp-server"}]
